,Nombres,Descripcion,Pagina
0,Latent Labs,Genere un mundo 3D en el que pueda mirar en función de su mensaje de texto. Tiene apoyo para diferentes versiones de difusión estable y tiene una comunidad de discordias a la que también puede unirse.,https://www.latentlabs.art/?utm_source=futurepedia&utm_medium=marketplace&utm_campaign=futurepedia
1,Pixela AI,AI generó texturas del juego. Todas estas imágenes se generaron con un algoritmo de difusión estable. ¡Sube tu textura generada para compartir con la comunidad!,https://pixela.ai/?utm_source=futurepedia&utm_medium=marketplace&utm_campaign=futurepedia
2,GET3D (Nvidia),Un modelo generativo de formas texturizadas en 3D de alta calidad aprendidas de las imágenes.,https://nv-tlabs.github.io/GET3D/?utm_source=futurepedia&utm_medium=marketplace&utm_campaign=futurepedia
3,Kinetix,La plataforma sin código para crear animaciones 3D de forma gratuita. Llévate al metaverso. No se requieren habilidades.,https://www.kinetix.tech/?utm_source=futurepedia&utm_medium=marketplace&utm_campaign=futurepedia
4,Ponzu,Condimentos de activos 3D con texturas generadas por IA.,https://www.ponzu.gg/?utm_source=futurepedia&utm_medium=marketplace&utm_campaign=futurepedia
