,Nombres,Descripcion,Pagina
0,Adobe Podcast,Actualice su audio con potentes mejoras y herramientas basadas en la web.,https://podcast.adobe.com/?utm_source=futurepedia&utm_medium=marketplace&utm_campaign=futurepedia
1,Chord Variations,Empodera a los músicos para elaborar sin esfuerzo la novela Acordes Progressions.,https://chord-alt.vercel.app/?utm_source=futurepedia&utm_medium=marketplace&utm_campaign=futurepedia
2,Ezdubs.ai,EzDubs es una herramienta con IA que desglosa las barreras del idioma en videos y transmisiones en vivo al proporcionar el doblaje de IA en tiempo real con preservación de voz.,https://www.ezdubs.ai/?utm_source=futurepedia&utm_medium=marketplace&utm_campaign=futurepedia
3,Drumloop AI,Generar bucles de batería con tecnología de IA,https://www.drumloopai.com/?utm_source=futurepedia&utm_medium=marketplace&utm_campaign=futurepedia
4,Databass,Databass es una herramienta de IA diseñada para revolucionar el panorama de audio al empoderar a los creadores para que desaten su ingenio sónico.,https://www.databass.ai/?utm_source=futurepedia&utm_medium=marketplace&utm_campaign=futurepedia
5,Adobe Enhance Speech,Filtro de audio con motor AI diseñado para mejorar las grabaciones de audio habladas,https://podcast.adobe.com/enhance?utm_source=futurepedia&utm_medium=marketplace&utm_campaign=futurepedia
6,Ai|coustics,Transforme su contenido de audio: eleva la calidad del habla al nivel de estudio con facilidad,https://ai-coustics.com/playground?utm_source=futurepedia&utm_medium=marketplace&utm_campaign=futurepedia
7,MusicLM,Generar música de alta calidad y consistente con MusicLM,https://google-research.github.io/seanet/musiclm/examples/?utm_source=futurepedia&utm_medium=marketplace&utm_campaign=futurepedia
8,Vocal Remover,Le permite separar la música de audio y fondo a través de AI,https://vocalremover.org/?utm_source=futurepedia&utm_medium=marketplace&utm_campaign=futurepedia
9,TTSLabs,"Personalización de TTS, voces personalizadas, clips de sonido e integración de twitch sin problemas para los streamers",https://ttslabs.ai/?utm_source=futurepedia&utm_medium=marketplace&utm_campaign=futurepedia
