,Nombres,Descripcion,Pagina
0,Codeium,"Codeium es la superpotencia de codificación moderna, un conjunto de herramientas de aceleración de código basado en la tecnología de IA de vanguardia. Con una fácil integración en los editores, puede concentrarse en ser el mejor desarrollador de software, no el mejor mono de código.",https://www.codeium.com/?utm_source=futurepedia&utm_medium=marketplace&utm_campaign=futurepedia
1,GitFluence,Gitfluence es una solución impulsada por IA que lo ayuda a encontrar rápidamente el comando correcto. Comience hoy con Git Command Generator y ahorre tiempo.,https://www.gitfluence.com/?utm_source=futurepedia&utm_medium=marketplace&utm_campaign=futurepedia
2,Phind,Busque cualquier consulta relacionada con el desarrollo utilizando el lenguaje natural y obtenga resultados relevantes. Puede personalizar su búsqueda en función del tiempo y puede alternar enlaces de visualización.,https://phind.com/?utm_source=futurepedia&utm_medium=marketplace&utm_campaign=futurepedia
3,Cron AI,Genere trabajos cron simplemente describiendo con qué frecuencia desea que funcionen.,https://cron-ai.vercel.app/?utm_source=futurepedia&utm_medium=marketplace&utm_campaign=futurepedia
4,Amazon CodeWhisperer,Amazon Codewhisperer es un servicio de aprendizaje automático (ML) que ayuda a mejorar la productividad del desarrollador mediante la generación de recomendaciones de código en función de sus comentarios en lenguaje natural y código en el entorno de desarrollo integrado (IDE).,https://aws.amazon.com/codewhisperer/?utm_source=futurepedia&utm_medium=marketplace&utm_campaign=futurepedia
5,AI CLI,"CLI de código abierto GPT -3
La longitud de solicitud actual es de ~ 840 tokens y el precio para Text-Davinci-002 es de $ 0.02 por tokens 1K, que es ~ $ 0.017/comando. Veremos si podemos mejorar la respuesta y reducir el costo por comando con ajuste fino.",https://github.com/abhagsain/ai-cli?utm_source=futurepedia&utm_medium=marketplace&utm_campaign=futurepedia
6,Google Colab Copilot,"AI Python Coding Assistant en Google Collab.
Para configurar,
1. Copie el JavaScript de GitHub.
2. Reemplace ""<su tecla API OpenAI>"" en el script con su tecla API OpenAI.
3. Abra y pegue el script en su consola en Google Colab. Siga esta guía de configuración.
4. Shift + Alt + Enter en Google Colab.",https://copilot.naklecha.com/?utm_source=futurepedia&utm_medium=marketplace&utm_campaign=futurepedia
7,Safurai,"Safurai es una extensión IDE basada en AI diseñada para ayudar a los desarrolladores con codificación, depuración y refactorización. Actúa como un asistente virtual, proporcionando soluciones y sugerencias para cualquier problema que pueda surgir durante el proceso de desarrollo de software. Con Safurai, los desarrolladores pueden mejorar su flujo de trabajo y su calidad de código, lo que hace que el proceso de desarrollo sea más eficiente y simplificado.",https://www.safurai.com?utm_source=futurepedia&utm_medium=marketplace&utm_campaign=futurepedia
8,CodiumAI,"En Codiumai, estamos redefiniendo y automatizando la integridad del código, inicialmente mediante la creación de una herramienta de desarrollo que permitirá que los desarrolladores ocupados generen suites de prueba significativas de manera interactiva dentro de su IDE.
Codiumai actualmente es compatible con Python, y el soporte de JS & TS llegará pronto.",https://www.codium.ai/?utm_source=futurepedia&utm_medium=marketplace&utm_campaign=futurepedia
9,Code GPT,"Code GPT es una extensión de código VS con excelentes características como soporte de stackoverflow, explicación, refactorización, documentación, búsqueda de problemas y pruebas unitarias.",https://marketplace.visualstudio.com/items?itemName=DanielSanMedium.dscodegpt?utm_source=futurepedia&utm_medium=marketplace&utm_campaign=futurepedia
10,Duino Code Generator,Genere automáticamente el código para cualquier placa compatible con Arduino con un solo clic. ¡Deja que AI haga el trabajo duro para que puedas pasar más tiempo jugando!,https://www.duinocodegenerator.com/?utm_source=futurepedia&utm_medium=marketplace&utm_campaign=futurepedia
11,Hacker AI,"Una IA que lo piratea para asegurar sus aplicaciones. Use para profesionales de ciberseguridad y cualquier otra persona que escriba código.
Hacker AI detecta vulnerabilidades en el código fuente. Gratis con una API freemium que se lanza pronto. Hecho por https://twitter.com/chaignc",https://hacker-ai.online?utm_source=futurepedia&utm_medium=marketplace&utm_campaign=futurepedia
12,Sketch,"Sketch es un asistente de escritura de código AI para usuarios de Pandas que comprende el contexto de sus datos, mejorando en gran medida la relevancia de las sugerencias. El boceto se puede utilizar en segundos y no requiere agregar un complemento a su IDE.",https://github.com/approximatelabs/sketch?utm_source=futurepedia&utm_medium=marketplace&utm_campaign=futurepedia
13,Airtest,"Genere pruebas unitarias usando AI. Admite varios idiomas, incluidos TypeScript y Python. También admite varios marcos de prueba como Mocha y Jest",https://www.airtest.dev/?utm_source=futurepedia&utm_medium=marketplace&utm_campaign=futurepedia
14,Maverick,"Maverick es una herramienta de finalización de código alimentada por AI. Construido en Yurts, Maverick se enfoca en entregar la mejor finalización del código en su máquina local sin llegar a ninguna API o bases de conocimiento.",https://marketplace.visualstudio.com/items?utm_source=futurepedia&utm_medium=marketplace&utm_campaign=futurepedia
15,Buildt,"Búsqueda con AI para encontrar código buscando lo que hace, no solo lo que es.
Una vez que encuentre la parte de la base de código, su IA le permite hacer cambios simplemente describiendo lo que desea.",https://www.buildt.ai/?utm_source=futurepedia&utm_medium=marketplace&utm_campaign=futurepedia
16,CodeGeeX,"CodeGeEx es un modelo de generación de código multilingüe a gran escala con 13 mil millones de parámetros, previamente entrenados en un cuerpo de código grande de más de 20 lenguajes de programación. CodeGeex admite más de 15 lenguajes de programación para la generación de códigos y la traducción",https://huggingface.co/spaces/THUDM/CodeGeeX?utm_source=futurepedia&utm_medium=marketplace&utm_campaign=futurepedia
17,Programminghelper,"Código más rápido con la ayuda de AI.
Genere el código simplemente escribiendo una descripción de texto. AI creará el código para usted. Pruébelo ahora.",https://www.programming-helper.com/?utm_source=futurepedia&utm_medium=marketplace&utm_campaign=futurepedia
18,CodeAssist,"CodeAssist (para IntelliJ) es un asistente de IA / chatbot / copilot para programación. Genera o cambia el código, dado una descripción de los cambios que desea hacer.

Después de instalar, puede abrirlo haciendo clic en la pestaña ""CodeAssist"" en la esquina inferior izquierda.

CodeAssist funciona con todos los lenguajes de programación populares.",https://plugins.jetbrains.com/plugin/20085-codeassist?utm_source=futurepedia&utm_medium=marketplace&utm_campaign=futurepedia
19,Clippy AI,"Clippy AI (VS Code Extension) es un envoltorio simple alrededor de OpenAI Codex. Le permite enviar a Codex su archivo actual, así como algunas instrucciones en inglés de texto sencillo. Luego abre una vista diferente en su editor para que pueda ver fácilmente los cambios sugeridos y aceptarlos o rechazarlos.",https://marketplace.visualstudio.com/items?utm_source=futurepedia&utm_medium=marketplace&utm_campaign=futurepedia
