,Nombres,Votos,Descripcion,Imagenes_url
0,Adcreative,529,Genere la conversión centrada en el anuncio y las redes sociales de las creaciones en cuestión de segundos. Obtenga mejores resultados mientras ahorra tiempo.,https://www.futurepedia.io/_next/image?url=https%3A%2F%2Fcdn.sanity.io%2Fimages%2Fu0v1th4q%2Fproduction%2Ff4dfd7dc734935e005e6e7cc8e884c99af99cd74-1680x876.png%3Frect%3D1%2C0%2C1679%2C876%26w%3D640%26h%3D334%26auto%3Dformat&w=3840&q=75
1,Munch,219,"Convierte automáticamente los videos de forma larga en clips cortos basados ​​en datos para las redes sociales. Munch genera exposición y participación al cosechar los usuarios de Tiktok, IG, YT y FB y aplicarlo a sus clips generados por AI.",https://www.futurepedia.io/_next/image?url=https%3A%2F%2Fcdn.sanity.io%2Fimages%2Fu0v1th4q%2Fproduction%2F15740143e29db461fedf87542ef0c3b161f2bdad-1720x952.jpg%3Frect%3D0%2C27%2C1720%2C898%26w%3D640%26h%3D334%26auto%3Dformat&w=3840&q=75
2,Jasper,277,"Cree contenido 10 veces más rápido con inteligencia artificial. Jasper es la herramienta de redacción de IA de la más alta calidad con más de 3,000 revisiones de 5 estrellas. Lo mejor para escribir publicaciones de blog, contenido de redes sociales y copia de marketing.",https://www.futurepedia.io/_next/image?url=https%3A%2F%2Fcdn.sanity.io%2Fimages%2Fu0v1th4q%2Fproduction%2Fcfd9366784a7fda98637b46b46d03631667a0839-1680x876.png%3Frect%3D1%2C0%2C1679%2C876%26w%3D640%26h%3D334%26auto%3Dformat&w=3840&q=75
3,Midjourney,763,"Generador de arte AI basado en difusión estable.
Su sitio web los describe como ""un laboratorio de investigación independiente que explora nuevos medios de pensamiento y expandiendo los poderes imaginativos de la especie humana"".",https://www.futurepedia.io/_next/image?url=https%3A%2F%2Fcdn.sanity.io%2Fimages%2Fu0v1th4q%2Fproduction%2Fafda32dcc5d187ec74c83b1a1480a99e591bde0f-1196x681.jpg%3Frect%3D0%2C29%2C1196%2C624%26w%3D640%26h%3D334%26auto%3Dformat&w=3840&q=75
4,HoppyCopy,120,"Escriba correos electrónicos de alta conversión, 10 veces más rápido.
Ahorre innumerables horas escribiendo. Use AI para generar una copia poderosa para cientos de diferentes campañas de marketing por correo electrónico, gotas, boletines y más.",https://www.futurepedia.io/_next/image?url=https%3A%2F%2Fcdn.sanity.io%2Fimages%2Fu0v1th4q%2Fproduction%2F54634a637e050e329af5bd813409247a6312b0da-1765x934.jpg%3Frect%3D0%2C7%2C1765%2C921%26w%3D640%26h%3D334%26auto%3Dformat&w=3840&q=75
5,Moonbeam,416,La IA de Moonbeam te dará todo lo que necesitas para escribir contenido de forma larga asesina. Ve 2x mejor en la escritura en 10 minutos.,https://www.futurepedia.io/_next/image?url=https%3A%2F%2Fcdn.sanity.io%2Fimages%2Fu0v1th4q%2Fproduction%2F33a90aa17d03d8ca27ede8c53aff254ee86dca26-1665x945.webp%3Frect%3D0%2C39%2C1665%2C869%26w%3D640%26h%3D334%26auto%3Dformat&w=3840&q=75
6,Soofy,41,"Soofy es una aplicación AI Language-Learning que ofrece un enfoque innovador para dominar un nuevo idioma. Con un enfoque en la práctica y los escenarios de la vida real, Soofy proporciona a los usuarios características para mejorar la pronunciación, la escritura y las habilidades de conversación. Desde escribir ensayos y describir imágenes hasta hacer debates y escenarios de juegos de roles con una IA, Soofy ofrece una amplia gama de opciones de lenguaje y características atractivas para ayudarlo a practicar y mejorar sus habilidades lingüísticas.",https://www.futurepedia.io/_next/image?url=https%3A%2F%2Fcdn.sanity.io%2Fimages%2Fu0v1th4q%2Fproduction%2F9b3aea9b50c4e0dc5321257364cc66ddfa07ed2d-1831x927.jpg%3Frect%3D28%2C0%2C1776%2C927%26w%3D640%26h%3D334%26auto%3Dformat&w=3840&q=75
7,Octane AI,11,El cuestionario de productos todo en uno de Octane AI y la plataforma de datos de partidos cero es la forma #1 para que las marcas Shopify aumenten los ingresos a través de la personalización.,"https://www.futurepedia.iodata:image/gif;base64,R0lGODlhAQABAIAAAAAAAP///yH5BAEAAAAALAAAAAABAAEAAAIBRAA7"
8,Chatty Cat,89,"Haga cualquier pregunta, chatee con mensajes de voz y solicite imágenes de AI en WhatsApp.","https://www.futurepedia.iodata:image/gif;base64,R0lGODlhAQABAIAAAAAAAP///yH5BAEAAAAALAAAAAABAAEAAAIBRAA7"
