,Nombres,Descripcion,Pagina
0,Autodraw,Autodraw es una herramienta de IA que le permite dibujar más rápido adivinando qué objeto o forma tiene la intención de dibujar.,https://autodraw.com/?utm_source=futurepedia&utm_medium=marketplace&utm_campaign=futurepedia
1,Visily AI,"Visily permite a los equipos con diversos fondos de diseño crear impresionantes estructuras y prototipos a velocidad de la luz. Con una amplia gama de características con IA, Visily también tiene plantillas prediseñadas, creación de prototipos y características de colaboración para hacer que el diseño de una experiencia fácil e intuitiva.",https://www.visily.ai/?utm_source=futurepedia&utm_medium=marketplace&utm_campaign=futurepedia
2,Rosebud,"AI generó imágenes
Le facilitamos obtener la visual exacta que necesita.",https://www.rosebud.ai/?utm_source=futurepedia&utm_medium=marketplace&utm_campaign=futurepedia
3,Vizcom,"Mira tus dibujos cobran vida en segundos, no horas.",https://www.vizcom.ai/?utm_source=futurepedia&utm_medium=marketplace&utm_campaign=futurepedia
