,Nombres,Descripcion,Pagina
0,REimagine Home,AI generativa para rediseñar cualquier habitación en segundos,https://www.reimaginehome.ai/?utm_source=futurepedia&utm_medium=marketplace&utm_campaign=futurepedia
1,Stylar,Socio de diseño con AI,https://www.stylar.ai/?utm_source=futurepedia&utm_medium=marketplace&utm_campaign=futurepedia
2,dotBRAND,Dotbrand es una herramienta con IA diseñada para capacitar a los diseñadores al ayudarlos a identificar clientes ideales y proporcionar sugerencias de diseño en segundos.,https://dotbrand.design/?utm_source=futurepedia&utm_medium=marketplace&utm_campaign=futurepedia
3,Paintit.ai,Paintit.ai es una herramienta con IA que permite a los usuarios generar visualizaciones interiores de IA únicas en minutos,https://paintit.ai/interior-ai/?utm_source=futurepedia&utm_medium=marketplace&utm_campaign=futurepedia
4,Magify.design,Genere diseños utilizando indicaciones basadas en un sistema de diseño.,https://www.magify.design/?utm_source=futurepedia&utm_medium=marketplace&utm_campaign=futurepedia
5,Autodraw,Herramienta de dibujo con AI para ayudarlo a dibujar más rápido.,https://autodraw.com/?utm_source=futurepedia&utm_medium=marketplace&utm_campaign=futurepedia
6,Varys AI,"Diseño de interiores ai para profesional, GPT para habitación y espacio",https://www.varys.ai/?utm_source=futurepedia&utm_medium=marketplace&utm_campaign=futurepedia
7,Lean Canvas AI,Elevación de la planificación comercial con lienzos Lean impulsados ​​por IA,https://leancanvasai.com/?utm_source=futurepedia&utm_medium=marketplace&utm_campaign=futurepedia
8,Banner GPT,Eleve las imágenes de su publicación de blog con AI,https://bannergpt.dabble.so/?utm_source=futurepedia&utm_medium=marketplace&utm_campaign=futurepedia
9,AI Palette,Creación de paleta de colores racionalización en figma,https://ai-palettes.com/?utm_source=futurepedia&utm_medium=marketplace&utm_campaign=futurepedia
10,TalkForm AI,Herramienta innovadora que simplifica la creación y el relleno de formularios mediante el uso de la funcionalidad de chat y las capacidades de IA.,https://www.talkform.ai/?utm_source=futurepedia&utm_medium=marketplace&utm_campaign=futurepedia
11,Typper,"Ofrece sugerencias de diseño, generación de contenido y soporte creativo de lluvia de ideas, racionalización del proceso de diseño.",https://www.typper.io/?utm_source=futurepedia&utm_medium=marketplace&utm_campaign=futurepedia
12,RestoGPT,"Sin esfuerzo, cree escaparates de pedidos en línea personalizados sin cobrar ninguna comisión.",https://restogpt.ai/?utm_source=futurepedia&utm_medium=marketplace&utm_campaign=futurepedia
13,Eden,"Los usuarios pueden transformar sus propias imágenes y garabatos en impresionantes obras de arte, democratizando la creatividad para todos.",https://www.ai.welcomejpeg.com/?utm_source=futurepedia&utm_medium=marketplace&utm_campaign=futurepedia
14,Motionshift,Sin esfuerzo produce videos y anuncios 2D y 3D de alta calidad sin requerir habilidades de diseño.,https://www.motionshift.io/?utm_source=futurepedia&utm_medium=marketplace&utm_campaign=futurepedia
15,AIPage.dev,Facilita la creación rápida y eficiente de páginas de destino visualmente llamativas,https://www.aipage.dev/?utm_source=futurepedia&utm_medium=marketplace&utm_campaign=futurepedia
16,Khroma,"Khroma es una herramienta de color diseñada para diseñadores, que proporciona acceso rápido a combinaciones de colores y paletas personalizadas.",https://www.khroma.co/?utm_source=futurepedia&utm_medium=marketplace&utm_campaign=futurepedia
17,Autoname,Autoname es una herramienta AI avanzada que permite a los usuarios cambiar automáticamente el nombre de varias capas en Figma con un solo clic.,https://www.autoname.org/?utm_source=futurepedia&utm_medium=marketplace&utm_campaign=futurepedia
18,Magic Prints,"Magic Prints es una herramienta de diseño de mercancías con IA que crea diseños de grado profesional para varios productos, lo que permite a los usuarios expresar su estilo y preferencias individuales.",https://magicprints.xyz/?utm_source=futurepedia&utm_medium=marketplace&utm_campaign=futurepedia
19,Charisma,Charisma es una plataforma con IA que permite la creación de historias interactivas con personajes virtuales.,https://charisma.ai/?utm_source=futurepedia&utm_medium=marketplace&utm_campaign=futurepedia
20,AI Wall Decor,AI Wall Decor es una herramienta poderosa que permite a los usuarios crear obras de arte enmarcadas únicas sin la necesidad de habilidades de pintura tradicionales.,https://aiwalldecor.com/?utm_source=futurepedia&utm_medium=marketplace&utm_campaign=futurepedia
21,Sutro,SUTRO es una herramienta de desarrollo de software con IA que aprovecha GPT-3 para permitir a los usuarios crear rápidamente aplicaciones.,https://withsutro.com/?utm_source=futurepedia&utm_medium=marketplace&utm_campaign=futurepedia
22,TileMaker,Rápidamente genera fondos de pantalla y fondos únicos.,https://tilemaker.app/?utm_source=futurepedia&utm_medium=marketplace&utm_campaign=futurepedia
23,Barcode.so,Hermososcodos de AI que hacen que a tu audiencia le encantaría,https://barcode.so/?utm_source=futurepedia&utm_medium=marketplace&utm_campaign=futurepedia
24,Genera.so,Iniciar aplicaciones de imágenes generativas en minutos,https://www.genera.so/?utm_source=futurepedia&utm_medium=marketplace&utm_campaign=futurepedia
25,Synexr,Explore sus diseños como nunca antes.,https://synexr.com/?utm_source=futurepedia&utm_medium=marketplace&utm_campaign=futurepedia
26,Kuart,Kuart es una herramienta AI que ofrece un generador de código QR a sus usuarios.,https://kuart.io/?utm_source=futurepedia&utm_medium=marketplace&utm_campaign=futurepedia#page-main
27,Dreamphilic,Creación y curación de contenido del sitio web.,https://dreamphilic.com/?utm_source=futurepedia&utm_medium=marketplace&utm_campaign=futurepedia
28,Design Sparks,Explore nuevas perspectivas y posibilidades para su proceso de diseño a través de chispas generadas por AI,https://designsparks.io/?utm_source=futurepedia&utm_medium=marketplace&utm_campaign=futurepedia
29,Oda Moodboard,Diseño interior personalizable con estilos y colores.,https://moodboard.odastudio.ai/?utm_source=futurepedia&utm_medium=marketplace&utm_campaign=futurepedia
30,Chroma AI,Generación de gradiente para asociación emocional en diseño.,https://chroma.szhao.dev/?utm_source=futurepedia&utm_medium=marketplace&utm_campaign=futurepedia
31,Permar AI,Tasas de conversión de página de destino mejoradas,https://www.permar.xyz/?utm_source=futurepedia&utm_medium=marketplace&utm_campaign=futurepedia
32,Seamless Studio,Generación de maquetas de alta calidad para requisitos personalizados.,https://www.seamless-studio.com/?utm_source=futurepedia&utm_medium=marketplace&utm_campaign=futurepedia
33,UX Brain,Su compinche con IA para la investigación de UX,https://uxbrain.co/?utm_source=futurepedia&utm_medium=marketplace&utm_campaign=futurepedia
34,Logo mockup,Generador de maqueta 3D premium para logotipos.,https://logo-mockup.com/?utm_source=futurepedia&utm_medium=marketplace&utm_campaign=futurepedia
35,AI HTML Generator - California Markup,Código HTML generado para el desarrollo web.,http://camarkup.com/?utm_source=futurepedia&utm_medium=marketplace&utm_campaign=futurepedia
36,GPT Mate,Texto generado y editado para el diseño de figma y figjam.,https://refiredesign.com/gptmate/?utm_source=futurepedia&utm_medium=marketplace&utm_campaign=futurepedia
37,GPT Stylist,Sugiere color y diseño para creadores.,https://refiredesign.com/gptstylist/?utm_source=futurepedia&utm_medium=marketplace&utm_campaign=futurepedia
38,Modif,Captura de movimiento simple para la animación de personajes digitales.,https://www.modif.app/?utm_source=futurepedia&utm_medium=marketplace&utm_campaign=futurepedia
39,Feathery AI,El primer constructor de formularios generativos para la creación de forma perfecta,http://feathery.ai/?utm_source=futurepedia&utm_medium=marketplace&utm_campaign=futurepedia
40,Calligrapher AI,Calligrapher.ai es una herramienta de inteligencia artificial basada en la web diseñada para generar escritura realista generada por computadora,https://www.calligrapher.ai/?utm_source=futurepedia&utm_medium=marketplace&utm_campaign=futurepedia
41,AI Backdrop,Actualice sus imágenes de productos de comercio electrónico con el generador de fondo AI.,https://background.zmo.ai/?utm_source=futurepedia&utm_medium=marketplace&utm_campaign=futurepedia
42,Locofy,"Enviar productos más rápido con herramientas de diseño existentes, pilas tecnológicas y flujos de trabajo",https://www.locofy.ai?utm_source=futurepedia&utm_medium=marketplace&utm_campaign=futurepedia
43,AI Studio,Cree escenas de fotografía para sus productos con fondos generados por IA,https://www.delete.bg/aistudio?utm_source=futurepedia&utm_medium=marketplace&utm_campaign=futurepedia
44,Pagegenie,Convierta instantáneamente la idea de su producto en una página de destino,https://pagegenie.io?utm_source=futurepedia&utm_medium=marketplace&utm_campaign=futurepedia
45,Vectorizer AI,¡Convierta sus mapas de bits JPEG y PNG en vectores SVG rápida y fácilmente con Vectorizer.ai!,https://vectorizer.ai/?utm_source=futurepedia&utm_medium=marketplace&utm_campaign=futurepedia
46,Visily AI,Diseñe impresionantes aplicaciones de aplicaciones a velocidad de luz,https://www.visily.ai/?utm_source=futurepedia&utm_medium=marketplace&utm_campaign=futurepedia
47,Vizcom,¡Dibuja y mira tus creaciones cobrar vida rápidamente!,https://www.vizcom.ai/?utm_source=futurepedia&utm_medium=marketplace&utm_campaign=futurepedia
