,Nombres,Descripcion,Pagina
0,Cookup,"Tiene una herramienta prefabricada para un montón de casos de uso para ayudar con la productividad y la creatividad, cosas como gestión de productos, marketing, programación, predicción, capital de riesgo y más",Https://cookup.ai?utm_source=futurepedia&utm_medium=marketplace&utm_campaign=futurepedia
1,fast.ai,Fast.AI es un grupo de investigación sin fines de lucro centrado en el aprendizaje profundo y la inteligencia artificial. Tienen varios cursos útiles en su sitio web.,https://www.fast.ai/?utm_source=futurepedia&utm_medium=marketplace&utm_campaign=futurepedia
2,AI Experiments,"AI Experiments es un escaparate de Google para experimentos simples que facilitan que cualquier persona comience a explorar el aprendizaje automático, a través de imágenes, dibujos, lenguaje, música y más. Puede encontrar herramientas como TalkTobooks y TeachableMachine aquí.",https://experiments.withgoogle.com/collection/ai?utm_source=futurepedia&utm_medium=marketplace&utm_campaign=futurepedia
3,Midjourney Splitter,"Use el mjsplitter para dividir su cuadrícula de mediana edad en imágenes individuales. Puede ingresar la imagen cargando o pegando un enlace.
Después de dividirse, puede descargar las imágenes y guardarlas en su computadora en JPEG. También puede compartir sus imágenes en las redes sociales.",https://www.mjsplitter.com/?utm_source=futurepedia&utm_medium=marketplace&utm_campaign=futurepedia
4,Lablab.ai,"Comunidad de fabricantes, construyendo con inteligencia artificial moderna y de última generación. Lablab.ai alberga hackatones regulares que enseñan cómo construir y usar diferentes tecnologías de IA.",https://lablab.ai/?utm_source=futurepedia&utm_medium=marketplace&utm_campaign=futurepedia
5,FlowGPT,"FlowGPT: Comparta, descubre y aprenda sobre las indicaciones de CHATGPT más útiles que lo ayudan a optimizar sus tareas y aumentar la productividad.",https://flowgpt.com/?utm_source=futurepedia&utm_medium=marketplace&utm_campaign=futurepedia
6,AI Art Apps Database,"Recursos de arte de IA, herramientas e inspiración para diseñadores e ingenieros rápidos. Encuentra todo lo que necesitas para el arte de IA.",https://aiartapps.com/?utm_source=futurepedia&utm_medium=marketplace&utm_campaign=futurepedia
7,The AI Times,Quédate con los tiempos de AI. Suscríbase para que los problemas de AI Times se envíen directamente a su bandeja de entrada directamente de la prensa digital.,https://www.aitimespage.com/ai?utm_source=futurepedia&utm_medium=marketplace&utm_campaign=futurepedia
8,ML news,Sitio web que agrega noticias relacionadas con IA y ML en japonés.,https://www.machine-learning.news/list/general?utm_source=futurepedia&utm_medium=marketplace&utm_campaign=futurepedia
