,Nombres,Descripcion,Pagina
0,Uberduck,"Proporciona a los usuarios herramientas para crear audio de voz en off con más de 5,000 voces expresivas, así como clones de voz personalizados. También tiene API para crear aplicaciones de audio y RAP generados por IA. Hay un estudio de caso para demostrar cómo se puede usar para crear medios personalizados y una lista de espera para unirse a la próxima plataforma Uberbots.",https://uberduck.ai/?utm_source=futurepedia&utm_medium=marketplace&utm_campaign=futurepedia
1,TTSMaker,"TTSMaker es una herramienta de texto a voz en línea completamente gratuita que admite un uso ilimitado, incluido el uso comercial.

Con más de 200 voces de IA y apoyo para múltiples idiomas, incluidos inglés, francés, alemán, español, árabe, chino, japonés, coreano, vietnamita y más, puede elegir entre una variedad de estilos de voz para leer su texto y libros electrónicos en voz alta .

También puede descargar los archivos de audio sintetizados. No se requiere registro o pago, puede usarlo directamente en línea de forma gratuita para siempre.",https://ttsmaker.com?utm_source=futurepedia&utm_medium=marketplace&utm_campaign=futurepedia
2,TTSLabs,"TTSLABS ofrece a Twitch Streamers la capacidad de personalizar su texto a donaciones de voz, habilitar voces personalizadas, agregar clips de sonido únicos y más. Todo con el poder de AI TTS e integración perfecta con Twitch, Streamlabs y Stamilelements.",https://ttslabs.ai/?utm_source=futurepedia&utm_medium=marketplace&utm_campaign=futurepedia
3,Ask My Book,"Pregunte mi libro es un experimento de IA de Sahil Lavingia, el fundador de Gumroad para que su libro sea más accesible. Puede usar pedirle a mi libro para hacer una pregunta y obtener una respuesta en su voz.",https://askmybook.com/?utm_source=futurepedia&utm_medium=marketplace&utm_campaign=futurepedia
4,Splashmusic,Trayendo la alegría de hacer música a todos,https://www.splashmusic.com/?utm_source=futurepedia&utm_medium=marketplace&utm_campaign=futurepedia
5,Whisper,"Whisper es un modelo de reconocimiento de voz de uso general. Está capacitado en un gran conjunto de datos de audio diverso y también es un modelo de varias tareas que puede realizar un reconocimiento de voz multilingüe, así como la traducción del habla y la identificación del lenguaje.",https://github.com/openai/whisper?utm_source=futurepedia&utm_medium=marketplace&utm_campaign=futurepedia
